<?xml version="1.0" encoding="UTF-8"?>
<!--
/*
* Copyright (C) 2015 STFC
* Licensed under the Apache License, Version 2.0 (the "License");
* you may not use this file except in compliance with the License.
* You may obtain a copy of the License at
* http://www.apache.org/licenses/LICENSE-2.0
* Unless required by applicable law or agreed to in writing, software
* distributed under the License is distributed on an "AS IS" BASIS,
* WITHOUT WARRANTIES OR CONDITIONS OF ANY KIND, either express or implied.
* See the License for the specific language governing permissions and
* limitations under the License.
*/
-->

<!-- 
XML doc instance for unit testing. 
-->
<RoleActionMappingRules     
    xmlns:xsi='http://www.w3.org/2001/XMLSchema-instance'
    xmlns='http://goc.egi.eu/2015/03/spec1.0_r1'
    xsi:schemaLocation='http://goc.egi.eu/2015/03/spec1.0_r1 ../../../../config/RoleActionMappingsSchema.xsd'> 

    <!--<RoleActionMapping> 
        <TargetProject>EGI</TargetProject>

        <RoleNames over="Project">
            <Role id="RH">RoleH</Role>
        </RoleNames>

        <RoleMapping>
            <Roles>
                <RoleRef idRef="RH"/>
            </Roles>
            <EnabledActions>
                <Actions>
                    <Action>AZ</Action>
                </Actions>
                <Target>project</Target>
            </EnabledActions>
        </RoleMapping>
    </RoleActionMapping>--> 


    <RoleActionMapping> 
        <!--<TargetProject>EGI2</TargetProject>-->

        <RoleNames over="Project">
            <Role id="RA">RoleA</Role>
            <Role id="RB">RoleB</Role>
            <Role id="RC">RoleC</Role>
            <Role id="RD">RoleD</Role>
            <Role id="RE">RoleE</Role>
            <Role id="RF">RoleF</Role>
        </RoleNames>
        
        <RoleMapping>
            <Roles>
                <RoleRef idRef="RA"/>
                <RoleRef idRef="RB"/>
                <RoleRef idRef="RC"/>
            </Roles>
            <EnabledActions>
                <Actions>
                    <Action>A1</Action>
                    <Action>A2</Action>
                    <Action>A3</Action>
                    <Action>AX</Action>
                </Actions>
                <Target>site</Target>
                <Target>service</Target>
            </EnabledActions>
        </RoleMapping>        

        <RoleMapping>
            <Roles>
                <RoleRef idRef="RD"/>
                <RoleRef idRef="RE"/>
            </Roles>
            <EnabledActions>
                <Actions>
                    <Action>A4</Action>
                    <Action>A5</Action>
                    <Action>AX</Action>
                </Actions>
                <Target>site</Target>
                <Target>service</Target>
                <Target>project</Target>
            </EnabledActions>
        </RoleMapping>      

        <RoleMapping>
            <Roles>
                <RoleRef idRef="RF"/>
            </Roles>
            <EnabledActions>
                <Actions>
                    <Action>A4</Action>
                    <Action>A5</Action>
                    <Action>AY</Action>
                </Actions>
                <Target>project</Target>
            </EnabledActions>
        </RoleMapping>
        
    </RoleActionMapping> 


</RoleActionMappingRules>
