<?xml version="1.0" encoding="UTF-8"?>
<!--
/*
* Copyright (C) 2015 STFC
* Licensed under the Apache License, Version 2.0 (the "License");
* you may not use this file except in compliance with the License.
* You may obtain a copy of the License at
* http://www.apache.org/licenses/LICENSE-2.0
* Unless required by applicable law or agreed to in writing, software
* distributed under the License is distributed on an "AS IS" BASIS,
* WITHOUT WARRANTIES OR CONDITIONS OF ANY KIND, either express or implied.
* See the License for the specific language governing permissions and
* limitations under the License.
*/
-->

<!-- -->
<RoleActionMappingRules     
    xmlns:xsi='http://www.w3.org/2001/XMLSchema-instance'
    xmlns='http://goc.egi.eu/2015/03/spec1.0_r1'
    xsi:schemaLocation='http://goc.egi.eu/2015/03/spec1.0_r1 ../../../../config/RoleActionMappingsSchema.xsd'> 

    <RoleActionMapping>
	
    </RoleActionMapping>

    <RoleActionMapping> 
        <TargetProject>EGI</TargetProject>
	
        <RoleNames over="Project">
            <Role id="COD_ADMIN">COD Administrator</Role>
        </RoleNames>  

        <RoleMapping>
            <Roles>
                <RoleRef idRef="COD_ADMIN"/> 
            </Roles>  
            <EnabledActions>
                <Actions>
                    <Action>ACTION_REVOKE_ROLE</Action>
                </Actions> 
                <Target>Project</Target> 
            </EnabledActions>
            <EnabledActions>
                <Actions>
                    <Action>ACTION_REVOKE_ROLE</Action>
                </Actions>
                <Target>Ngi</Target>
            </EnabledActions>
        </RoleMapping>
	
    </RoleActionMapping> 

    <RoleActionMapping> 
        <TargetProject>EGI2</TargetProject>
    </RoleActionMapping>


</RoleActionMappingRules>
